mack,tencongty,sanck,vonhoa
AAA,CTCP Nhựa An Phát Xanh,HOSE,3333433605120.0
AAH,CTCP Hợp Nhất,UPCOM,424440000000.0
AAM,CTCP Thủy sản MeKong,HOSE,76293628600.0
AAS,CTCP Chứng khoán SmartInvest,UPCOM,2046995736900.0
AAT,CTCP Tập Đoàn Tiên Sơn Thanh Hóa,HOSE,246450478440.0
AAV,CTCP AAV Group,HNX,503609925300.0
ABB,Ngân hàng TMCP An Bình,UPCOM,7659272038800.0
ABC,CTCP Truyền thông VMG,UPCOM,242629100000.0
ABI,CTCP Bảo hiểm Ngân hàng Nông nghiệp Việt Nam,UPCOM,2137006500000.0
ABR,CTCP Đầu tư Nhãn hiệu Việt,HOSE,260000000000.0
ABS,CTCP Dịch vụ Nông nghiệp Bình Thuận,HOSE,368000000000.0
ABT,CTCP Xuất nhập khẩu Thủy sản Bến Tre,HOSE,465790514350.0
ABW,CTCP Chứng khoán An Bình,UPCOM,849660000000.0
ACB,Ngân hàng TMCP Á Châu,HOSE,115239774129600.0
ACC,CTCP Đầu tư và Xây dựng Bình Dương ACC,HOSE,1532999897800.0
ACG,CTCP Gỗ An Cường,HOSE,6302936142800.0
ACL,CTCP Xuất nhập khẩu Thủy sản Cửu Long An Giang,HOSE,596892326100.0
ACV,Tổng Công ty Cảng Hàng không Việt Nam - CTCP,UPCOM,274078059892400.0
ADC,CTCP Mỹ thuật và Truyền thông,HNX,83536656000.0
ADG,CTCP Clever Group,HOSE,241599887300.0
ADP,CTCP Sơn Á Đông,HOSE,667003657500.0
ADS,CTCP Damsan,HOSE,669217808520.0
AFX,CTCP Xuất nhập khẩu Nông sản Thực phẩm An Giang,UPCOM,266000000000.0
AGF,CTCP Xuất nhập khẩu Thủy sản An Giang,UPCOM,84329229000.0
AGG,CTCP Đầu tư và Phát triển Bất động sản An Gia,HOSE,2502932447400.0
AGM,CTCP Xuất Nhập khẩu An Giang,HOSE,60424000000.0
AGP,CTCP Dược phẩm Agimexpharm,UPCOM,900299304900.0
AGR,CTCP Chứng khoán Agribank,HOSE,3650881890900.0
AIC,Tổng Công ty Cổ phần Bảo hiểm Hàng không,UPCOM,1100000000000.0
AIG,CTCP Nguyên liệu Á Châu AIG,UPCOM,7881779967600.0
ALT,CTCP Văn hóa Tân Bình,HNX,68266837100.0
AMC,CTCP Khoáng sản Á Châu,HNX,45600000000.0
AME,CTCP Alphanam E&C,HNX,306440000000.0
AMS,CTCP Cơ khí Xây dựng AMECC,UPCOM,576000000000.0
AMV,CTCP Sản xuất Kinh doanh Dược và Trang thiết bị Y tế Việt Mỹ,HNX,196658475000.0
ANT,CTCP Rau quả Thực phẩm An Giang,UPCOM,358796548500.0
ANV,CTCP Nam Việt,HOSE,5271863850000.0
APC,CTCP Chiếu xạ An Phú,UPCOM,132801207000.0
APF,CTCP Nông sản Thực phẩm Quảng Ngãi,UPCOM,1637381790000.0
APG,CTCP Chứng khoán APG,HOSE,1491558353140.0
APH,CTCP Tập đoàn An Phát Holdings,HOSE,1707189876000.0
API,CTCP Đầu tư Châu Á - Thái Bình Dương,HNX,655855012800.0
APS,CTCP Chứng khoán Châu Á Thái Bình Dương,HNX,539500000000.0
ARM,CTCP Xuất nhập khẩu Hàng không,HNX,78093203300.0
ART,CTCP Chứng khoán BOS,UPCOM,125999261700.0
ASG,CTCP Tập đoàn ASG,HOSE,1661359442700.0
ASM,CTCP Tập đoàn Sao Mai,HOSE,3183532950000.0
ASP,CTCP Tập đoàn Dầu khí An Pha,HOSE,147864586320.0
AST,CTCP Dịch vụ Hàng không Taseco,HOSE,2452500000000.0
ATG,CTCP An Trường An,UPCOM,31962000000.0
ATS,CTCP Tập đoàn Đầu tư ATS,HNX,52500000000.0
AVC,CTCP Thủy điện A Vương,UPCOM,4067821218400.0
AVG,CTCP Phân bón Quốc tế Âu Việt,UPCOM,518023472600.0
BAB,Ngân hàng TMCP Bắc Á,HNX,10751203704000.0
BAF,CTCP Nông nghiệp BAF Việt Nam,HOSE,6716508140200.0
BAX,CTCP Thống Nhất,HNX,332100000000.0
BBC,CTCP Bibica,HOSE,1007019291900.0
BBM,CTCP Bia Hà Nội - Nam Định,UPCOM,14400000000.0
BBS,CTCP VICEM Bao bì Bút Sơn,HNX,61200000000.0
BCA,CTCP B.C.H,UPCOM,209000000000.0
BCC,CTCP Xi măng Bỉm Sơn,HNX,899431627600.0
BCE,CTCP Xây dựng và Giao thông Bình Dương,HOSE,297500000000.0
BCF,CTCP Thực phẩm Bích Chi,HNX,1372837126500.0
BCG,CTCP Tập đoàn Bamboo Capital,HOSE,5598139695840.0
BCM,Tổng Công ty Đầu tư và Phát triển Công nghiệp – CTCP,HOSE,73381500000000.0
BCR,CTCP BCG Land,UPCOM,2226859591100.0
BDB,CTCP Sách và Thiết bị Bình Định,HNX,8899144600.0
BDG,CTCP May mặc Bình Dương,UPCOM,838237296000.0
BDT,CTCP Xây lắp và Vật liệu Xây dựng Đồng Tháp,UPCOM,266308260000.0
BDW,CTCP Cấp thoát nước Bình Định,UPCOM,305305680000.0
BED,CTCP Sách và Thiết bị Trường học Đà Nẵng,HNX,92400000000.0
BFC,CTCP Phân bón Bình Điền,HOSE,2301011718250.0
BGE,CTCP BCG Energy,UPCOM,6935000000000.0
BGW,CTCP Nước sạch Bắc Giang,UPCOM,290391136000.0
BHA,CTCP Thủy điện Bắc Hà,UPCOM,1452000000000.0
BHC,CTCP Bê tông Biên Hòa,UPCOM,7650000000.0
BHI,Tổng Công ty cổ phần Bảo hiểm Sài Gòn - Hà Nội,UPCOM,1100000000000.0
BHK,CTCP Bia Hà Nội - Kim Bài,UPCOM,77727000000.0
BHN,Tổng Công ty cổ phần Bia - Rượu - Nước giải khát Hà Nội,HOSE,8819990000000.0
BIC,Tổng Công ty cổ phần Bảo hiểm Ngân hàng Đầu tư và Phát triển Việt Nam,HOSE,3969822895750.0
BID,Ngân hàng TMCP Đầu tư và Phát triển Việt Nam,HOSE,214051368045000.0
BKC,CTCP Khoáng sản Bắc Kạn,HNX,167849510400.0
BKG,CTCP Đầu tư BKG Việt Nam,HOSE,234877585600.0
BLI,Tổng Công ty cổ phần Bảo hiểm Bảo Long,UPCOM,605994687400.0
BMC,CTCP Khoáng sản Bình Định,HOSE,261484493000.0
BMF,CTCP Vật liệu Xây dựng và Chất đốt Đồng Nai,UPCOM,137878148100.0
BMI,Tổng Công ty cổ phần Bảo Minh,HOSE,2785499178000.0
BMJ,CTCP Khoáng sản Miền Đông AHP,UPCOM,1259999736000.0
BMP,CTCP Nhựa Bình Minh,HOSE,10731968971800.0
BMS,CTCP Chứng khoán Bảo Minh,UPCOM,782225675000.0
BMV,CTCP Bột mỳ Vinafood 1,UPCOM,186340000000.0
BNA,CTCP Tập đoàn Đầu tư Bảo Ngọc,HNX,318743818800.0
BNW,CTCP Nước sạch Bắc Ninh,UPCOM,345454397200.0
BOT,CTCP BOT Cầu Thái Hà,UPCOM,159966360000.0
BPC,CTCP VICEM Bao bì Bỉm Sơn,HNX,37620000000.0
BRC,CTCP Cao su Bến Thành,HOSE,178199956800.0
BRR,CTCP Cao su Bà Rịa,UPCOM,2137500000000.0
BSA,CTCP Thủy điện Buôn Đôn,UPCOM,1490776742500.0
BSC,CTCP Dịch vụ Bến Thành,HNX,46000906200.0
BSG,CTCP Xe khách Sài Gòn,UPCOM,702000000000.0
BSH,CTCP Bia Sài Gòn - Hà Nội,UPCOM,336600000000.0
BSI,CTCP Chứng khoán BIDV,HOSE,10840750068600.0
BSL,CTCP Bia Sài Gòn - Sông Lam,UPCOM,450000000000.0
BSP,CTCP Bia Sài Gòn - Phú Thọ,UPCOM,126250000000.0
BSQ,CTCP Bia Sài Gòn - Quảng Ngãi,UPCOM,931500000000.0
BSR,CTCP Lọc hóa Dầu Bình Sơn,HOSE,70691391244800.0
BST,CTCP Sách và Thiết bị Bình Thuận,HNX,16280000000.0
BTH,CTCP Chế tạo Biến thế và Vật liệu Điện Hà Nội,UPCOM,892500000000.0
BTP,CTCP Nhiệt điện Bà Rịa,HOSE,725827200000.0
BTS,CTCP Xi măng VICEM Bút Sơn,HNX,605443304200.0
BTT,CTCP Thương mại Dịch vụ Bến Thành,HOSE,546750000000.0
BTV,CTCP Dịch vụ Du lịch Bến Thành,UPCOM,346896740000.0
BTW,CTCP Cấp nước Bến Thành,HNX,380016000000.0
BVB,Ngân hàng TMCP Bản Việt,UPCOM,6401416094000.0
BVH,Tập đoàn Bảo Việt,HOSE,37635764134800.0
BVL,CTCP BV Land,UPCOM,761652360000.0
BVS,CTCP Chứng khoán Bảo Việt,HNX,2671405365000.0
BWE,CTCP - Tổng công ty nước - môi trường Bình Dương,HOSE,10446610590000.0
BWS,CTCP Cấp nước Bà Rịa - Vũng Tàu,UPCOM,3390256589100.0
BXH,CTCP VICEM Bao bì Hải Phòng,HNX,45481804000.0
C21,CTCP Thế Kỷ 21,UPCOM,310170863700.0
C32,CTCP CIC39,HOSE,264530552000.0
C47,CTCP Xây dựng 47,HOSE,218053614000.0
C4G,CTCP Tập đoàn CIENCO4,UPCOM,2822675956600.0
C69,CTCP Xây dựng 1369,HNX,407879815200.0
CAD,CTCP Chế biến và Xuất nhập khẩu Thủy sản Cadovimex,UPCOM,10399963500.0
CAG,CTCP Cảng An Giang,HNX,109020000000.0
CAN,CTCP Đồ hộp Hạ Long,HNX,270000000000.0
CAP,CTCP Lâm Nông sản Thực phẩm Yên Bái,HNX,670351463500.0
CAR,CTCP Tập đoàn Giáo dục Trí Việt,HNX,102193779600.0
CBI,CTCP Gang thép Cao Bằng,UPCOM,408560477000.0
CC1,Tổng Công ty Xây dựng Số 1 - CTCP,UPCOM,5730720400000.0
CC4,CTCP Đầu tư và Xây dựng Số 4,UPCOM,1068800000000.0
CCA,CTCP Xuất nhập khẩu Thuỷ sản Cần Thơ,UPCOM,233478289000.0
CCI,CTCP Đầu tư Phát triển Công nghiệp Thương mại Củ Chi,HOSE,442035846000.0
CCL,CTCP Đầu tư và Phát triển Đô thị Dầu khí Cửu Long,HOSE,536828576180.0
CCR,CTCP Cảng Cam Ranh,HNX,332569191200.0
CCT,CTCP Cảng Cần Thơ,UPCOM,273408000000.0
CDC,CTCP Chương Dương,HOSE,374907607800.0
CDN,CTCP Cảng Đà Nẵng,HNX,3366000000000.0
CDO,CTCP Tư vấn Thiết kế và Phát triển Đô thị,UPCOM,59859452500.0
CDP,CTCP Dược phẩm Trung ương Codupha,UPCOM,185729760000.0
CEN,CTCP CENCON Việt Nam,UPCOM,43424880000.0
CEO,CTCP Tập đoàn C.E.O,HNX,7133364902400.0
CET,CTCP HTC Holding,HNX,27830000000.0
CFV,CTCP Cà phê Thắng Lợi,UPCOM,320045000000.0
CHP,CTCP Thủy điện Miền Trung,HOSE,4950956911600.0
CHS,CTCP Chiếu sáng Công cộng Thành phố Hồ Chí Minh,UPCOM,369200000000.0
CIA,CTCP Dịch vụ Sân bay Quốc tế Cam Ranh,HNX,192210802900.0
CIG,CTCP COMA 18,HOSE,257050568050.0
CII,CTCP Đầu tư Hạ tầng Kỹ thuật Thành phố Hồ Chí Minh,HOSE,4460546161350.0
CJC,CTCP Cơ điện Miền Trung,HNX,206400000000.0
CKD,CTCP Cơ khí Đông Anh LICOGI,UPCOM,706800000000.0
CKG,CTCP Tập đoàn Tư vấn Đầu tư Xây dựng Kiên Giang,HOSE,2152861558600.0
CKV,CTCP COKYVINA,HNX,52156000000.0
CLC,CTCP Cát Lợi,HOSE,1362794316000.0
CLH,CTCP Xi măng La Hiên VVMI,HNX,260400000000.0
CLL,CTCP Cảng Cát Lái,HOSE,1217200000000.0
CLM,CTCP Xuất nhập khẩu Than - Vinacomin,HNX,845900000000.0
CLW,CTCP Cấp nước Chợ Lớn,HOSE,550550000000.0
CLX,CTCP Xuất nhập khẩu và Đầu tư Chợ Lớn (CHOLIMEX),UPCOM,1446220000000.0
CMC,CTCP Đầu tư CMC,HNX,25541880000.0
CMD,CTCP Vật liệu Xây dựng và Trang trí nội thất Thành phố Hồ Chí Minh,UPCOM,245718000000.0
CMI,CTCP CMISTONE Việt Nam,UPCOM,19200000000.0
CMM,CTCP Camimex,UPCOM,854204981400.0
CMP,CTCP Cảng Chân Mây,UPCOM,262483861500.0
CMS,CTCP Tập Đoàn CMH Việt Nam,HNX,249434500000.0
CMV,CTCP Thương nghiệp Cà Mau,HOSE,154324878000.0
CMW,CTCP Cấp nước Cà Mau,UPCOM,187972290000.0
CMX,CTCP Camimex Group,HOSE,801945051300.0
CNG,CTCP CNG Việt Nam,HOSE,1088078238000.0
CNT,CTCP Tập đoàn CNT,UPCOM,689011154500.0
COM,CTCP Vật tư Xăng Dầu,HOSE,413734400400.0
CPA,CTCP Cà phê Phước An,UPCOM,170121528000.0
CPC,CTCP Thuốc sát trùng Cần Thơ,HNX,73466100000.0
CPI,CTCP Đầu tư Cảng Cái Lân,UPCOM,175224000000.0
CQN,CTCP Cảng Quảng Ninh,UPCOM,2341558003200.0
CQT,CTCP Xi măng Quán Triều VVMI,UPCOM,215000000000.0
CRC,CTCP Create Capital Việt Nam,HOSE,407400000000.0
CRE,CTCP Bất động sản Thế Kỷ,HOSE,3616691722800.0
CSC,CTCP Tập đoàn COTANA,HNX,1017524310400.0
CSI,CTCP Chứng khoán Kiến thiết Việt Nam,UPCOM,562800000000.0
CSM,CTCP Công nghiệp Cao su Miền Nam,HOSE,1601010297900.0
CST,CTCP Than Cao Sơn - TKV,HNX,1045461261200.0
CSV,CTCP Hóa chất Cơ bản Miền Nam,HOSE,5049845887000.0
CTB,CTCP Chế tạo Bơm Hải Dương,HNX,265392000000.0
CTD,CTCP Xây dựng Coteccons,HOSE,6865191961800.0
CTF,CTCP City Auto,HOSE,2104384898000.0
CTG,Ngân hàng TMCP Công Thương Việt Nam,HOSE,202985688074400.0
CTI,CTCP Đầu tư Phát triển Cường Thuận IDICO,HOSE,1046679942700.0
CTP,CTCP Hòa Bình Takara,HNX,350899768000.0
CTR,Tổng Công ty cổ phần Công trình Viettel,HOSE,14241041935500.0
CTS,CTCP Chứng khoán Ngân hàng Công thương Việt Nam,HOSE,5280210040500.0
CTT,CTCP Chế tạo Máy - Vinacomin,HNX,70460265000.0
CTW,CTCP Cấp thoát nước Cần Thơ,UPCOM,881955900000.0
CTX,Tổng Công ty cổ phần Đầu tư Xây dựng và Thương mại Việt Nam,UPCOM,599695297600.0
CVN,CTCP Vinam,HNX,56429982900.0
CVT,CTCP CMC,HOSE,930113985450.0
CX8,CTCP Đầu tư và Xây lắp Constrexim Số 8,HNX,22446118800.0
D11,CTCP Địa ốc 11,HNX,74115193800.0
D2D,CTCP Phát triển Đô thị Công nghiệp số 2,HOSE,959233821400.0
DAC,CTCP 382 Đông Anh,UPCOM,4522383000.0
DAD,CTCP Đầu tư và Phát triển Giáo dục Đà Nẵng,HNX,99240960000.0
DAE,CTCP Sách Giáo dục tại Thành phố Đà Nẵng,HNX,32928751800.0
DAH,CTCP Tập đoàn Khách sạn Đông Á,HOSE,286280000000.0
DAN,CTCP Dược Danapha,UPCOM,649078000000.0
DAT,CTCP Đầu tư du lịch và Phát triển Thủy sản,HOSE,539981059800.0
DBC,CTCP Tập đoàn Dabaco Việt Nam,HOSE,9287068773750.0
DBD,CTCP Dược - Trang thiết bị Y tế Bình Định (BIDIPHAR),HOSE,5388696691200.0
DBT,CTCP Dược phẩm Bến Tre,HOSE,250473930000.0
DC2,CTCP Đầu tư - Phát triển - Xây dựng (DIC) Số 2,HNX,83414940000.0
DC4,CTCP Xây dựng DIC Holdings,HOSE,773840177800.0
DCF,CTCP Xây dựng và Thiết kế Số 1,UPCOM,2070000000000.0
DCL,CTCP Dược phẩm Cửu Long,HOSE,1953847552500.0
DCM,CTCP Phân bón Dầu khí Cà Mau,HOSE,18846640000000.0
DCT,CTCP Tấm lợp Vật liệu Xây dựng Đồng Nai,UPCOM,16334188200.0
DDG,CTCP Đầu tư Công nghiệp Xuất nhập khẩu Đông Dương,HNX,239519658000.0
DDM,CTCP Hàng Hải Đông Đô,UPCOM,23264534800.0
DDN,CTCP Dược và Thiết bị Y tế Đà Nẵng,UPCOM,119724758400.0
DDV,CTCP DAP - VINACHEM,UPCOM,2878365030000.0
DFF,CTCP Tập đoàn Đua Fat,UPCOM,136000000000.0
DGC,CTCP Tập đoàn Hóa chất Đức Giang,HOSE,44282162955800.0
DGT,CTCP Công trình Giao thông Đồng Nai,UPCOM,474000000000.0
DGW,CTCP Thế Giới Số,HOSE,8810581740000.0
DHA,CTCP Hóa An,HOSE,635430049950.0
DHB,CTCP Phân đạm và Hóa chất Hà Bắc,UPCOM,2449800000000.0
DHC,CTCP Đông Hải Bến Tre,HOSE,3034587909600.0
DHD,CTCP Dược Vật tư Y tế Hải Dương,UPCOM,785319607700.0
DHG,CTCP Dược Hậu Giang,HOSE,13584516776900.0
DHM,CTCP Thương mại và Khai thác Khoáng sản Dương Hiếu,HOSE,292862727520.0
DHP,CTCP Điện cơ Hải Phòng,HNX,102515760000.0
DHT,CTCP Dược phẩm Hà Tây,HNX,7822324700000.0
DID,CTCP DIC - Đồng Tiến,UPCOM,67176973600.0
DIG,Tổng Công ty cổ phần Đầu tư Phát triển Xây dựng,HOSE,11526202705500.0
DIH,CTCP Đầu tư Phát triển Xây dựng - Hội An,HNX,110306624000.0
DL1,CTCP Tập đoàn Alpha Seven,HNX,541804079400.0
DLG,CTCP Tập đoàn Đức Long Gia Lai,HOSE,622564217600.0
DLR,CTCP Địa ốc Đà Lạt,UPCOM,89550000000.0
DM7,CTCP Dệt May 7,UPCOM,339044200000.0
DMC,CTCP Xuất nhập khẩu Y Tế Domesco,HOSE,2396195085000.0
DMN,CTCP Domenal,UPCOM,68750000000.0
DNA,CTCP Điện Nước An Giang,UPCOM,1295580041000.0
DNC,CTCP Điện Nước Lắp máy Hải Phòng,HNX,537861260000.0
DND,CTCP Đầu tư Xây dựng và Vật liệu Đồng Nai,UPCOM,218178000000.0
DNH,CTCP Thủy điện Đa Nhim - Hàm Thuận - Đa Mi,UPCOM,14699520000000.0
DNN,CTCP Cấp nước Đà Nẵng,UPCOM,11592812200.0
DNP,CTCP DNP Holding,HNX,2889803738000.0
DNW,CTCP Cấp nước Đồng Nai,UPCOM,4020000000000.0
DP1,CTCP Dược phẩm Trung ương CPC1,UPCOM,803495700000.0
DP2,CTCP Dược phẩm Trung ương 2,UPCOM,104000000000.0
DP3,CTCP Dược phẩm Trung ương 3,HNX,1253446093900.0
DPC,CTCP Nhựa Đà Nẵng,UPCOM,19016880000.0
DPG,CTCP Tập đoàn Đạt Phương,HOSE,2897979484000.0
DPM,Tổng Công ty Phân bón và Hóa chất Dầu khí - CTCP,HOSE,13696699100000.0
DPR,CTCP Cao su Đồng Phú,HOSE,3371174161600.0
DQC,CTCP Tập đoàn Điện Quang,HOSE,347231631600.0
DRC,CTCP Cao su Đà Nẵng,HOSE,3385589242500.0
DRG,CTCP Cao su Đắk Lắk,UPCOM,1215240000000.0
DRH,CTCP DRH Holdings,HOSE,235044945400.0
DRI,CTCP Đầu tư Cao su Đắk Lắk,UPCOM,922320000000.0
DRL,CTCP Thủy điện - Điện Lực 3,HOSE,542450000000.0
DS3,CTCP Quản lý Đường sông Số 3,HNX,55482596000.0
DSC,CTCP Chứng khoán DSC,HOSE,3441293940000.0
DSD,CTCP DHC Suối Đôi,UPCOM,772440000000.0
DSE,CTCP Chứng khoán DNSE,HOSE,8745000000000.0
DSG,CTCP Kính Đáp Cầu,UPCOM,138000000000.0
DSN,CTCP Công viên nước Đầm Sen,HOSE,664565495000.0
DSP,CTCP Dịch vụ Du lịch Phú Thọ,UPCOM,1792128400000.0
DST,CTCP Đầu tư Sao Thăng Long,HNX,180426400000.0
DTA,CTCP Đệ Tam,HOSE,71878131360.0
DTC,CTCP Viglacera Đông Triều,HNX,48000000000.0
DTD,CTCP Đầu tư Phát triển Thành Đạt,HNX,1552197195000.0
DTG,CTCP Dược phẩm Tipharco,HNX,182921348700.0
DTI,CTCP Đầu tư Đức Trung,UPCOM,29675360000.0
DTK,Tổng Công ty Điện lực TKV - CTCP,HNX,9422191155000.0
DTL,CTCP Đại Thiên Lộc,HOSE,615404487600.0
DTP,CTCP Dược phẩm CPC1 Hà Nội,UPCOM,2223378754000.0
DTT,CTCP Kỹ nghệ Đô Thành,HOSE,169150265000.0
DVG,CTCP Đại Việt Group DVG,UPCOM,33600000000.0
DVM,CTCP Dược liệu Việt Nam,HNX,333683344800.0
DVN,Tổng Công ty Dược Việt Nam - CTCP,UPCOM,5948700000000.0
DVP,CTCP Đầu tư và Phát triển Cảng Đình Vũ,HOSE,3280000000000.0
DWC,CTCP Cấp nước Đắk Lắk,UPCOM,441280000000.0
DWS,CTCP Cấp nước và Môi trường đô thị Đồng Tháp,UPCOM,318792999000.0
DXG,CTCP Tập đoàn Đất Xanh,HOSE,11242973586000.0
DXP,CTCP Cảng Đoạn Xá,HNX,694957542800.0
DXS,CTCP Dịch vụ Bất động sản Đất Xanh,HOSE,4169542492800.0
DXV,CTCP VICEM Vật liệu Xây dựng Đà Nẵng,HOSE,37620000000.0
DZM,CTCP Cơ điện Dzĩ An,UPCOM,15648356500.0
E12,CTCP Xây dựng Điện VNECO12,UPCOM,7200000000.0
EBS,CTCP Sách Giáo dục tại Thành phố Hà Nội,HNX,108624865600.0
ECI,CTCP Tập Đoàn ECI,HNX,35024000000.0
ECO,CTCP Nhựa sinh thái Việt Nam,UPCOM,310000000000.0
EIB,Ngân hàng TMCP Xuất nhập khẩu Việt Nam,HOSE,35950507715100.0
EIC,CTCP EVN Quốc tế,UPCOM,799561761000.0
EID,CTCP Đầu tư và Phát triển Giáo dục Hà Nội,HNX,402000000000.0
EIN,CTCP Đầu tư - Thương mại - Dịch vụ Điện Lực,UPCOM,108977186400.0
ELC,CTCP Công Nghệ - Viễn Thông Elcom,HOSE,2240503071300.0
EMS,Tổng Công ty Chuyển phát nhanh Bưu Điện - CTCP,UPCOM,577484600000.0
EPH,CTCP Dịch vụ Xuất bản Giáo dục Hà Nội,UPCOM,40000000000.0
EVE,CTCP Everpia,HOSE,434490650550.0
EVF,Công ty Tài chính Cổ phần Điện lực,HOSE,6921148798200.0
EVG,CTCP Tập đoàn EverLand,HOSE,1341006478280.0
EVS,CTCP Chứng khoán Everest,HNX,939363522600.0
FCM,CTCP Khoáng sản FECON,HOSE,155783729620.0
FCN,CTCP FECON,HOSE,2298609473000.0
FCS,CTCP Lương thực Thành phố Hồ Chí Minh,UPCOM,217930000000.0
FDC,CTCP Ngoại thương và  Phát triển Đầu tư Thành phố Hồ Chí Minh,HOSE,652736947200.0
FGL,CTCP Cà phê Gia Lai,UPCOM,148230630000.0
FHS,CTCP Phát hành Sách Thành phố Hồ Chí Minh,UPCOM,433549708000.0
FIC,Tổng Công ty Vật liệu Xây dựng số 1 - CTCP,UPCOM,1866900000000.0
FID,CTCP Đầu tư và Phát triển Doanh nghiệp Việt Nam,HNX,37073937000.0
FIR,CTCP Địa ốc First Real,HOSE,372622629800.0
FIT,CTCP Tập đoàn F.I.T,HOSE,1434517403480.0
FMC,CTCP Thực phẩm Sao Ta,HOSE,3073277783000.0
FOC,CTCP Dịch vụ Trực tuyến FPT,UPCOM,1501220546000.0
FOX,CTCP Viễn thông FPT,UPCOM,47773388908000.0
FPC,CTCP Full Power,OTC,52799985600.0
FPT,CTCP FPT,HOSE,224338050407500.0
FRT,CTCP Bán lẻ Kỹ thuật số FPT,HOSE,25286587398400.0
FTM,CTCP Đầu tư và Phát triển Đức Quân,UPCOM,40000000000.0
FTS,CTCP Chứng khoán FPT,HOSE,12909797245200.0
G36,Tổng Công ty 36 - CTCP,UPCOM,684717442200.0
GAS,Tổng Công ty Khí Việt Nam - CTCP,HOSE,159536025783900.0
GCF,CTCP Thực phẩm G.C,UPCOM,733251976100.0
GDA,CTCP Tôn Đông Á,UPCOM,3142547374000.0
GDT,CTCP Chế biến Gỗ Đức Thành,HOSE,639477263700.0
GDW,CTCP Cấp nước Gia Định,HNX,284050000000.0
GEE,CTCP Điện lực Gelex,HOSE,10290000000000.0
GEG,CTCP Điện Gia Lai,HOSE,4299700452000.0
GEX,CTCP Tập đoàn GELEX,HOSE,16415109046300.0
GGG,CTCP Ô tô Giải Phóng,UPCOM,55838319100.0
GHC,CTCP Thủy điện Gia Lai,UPCOM,1334550000000.0
GIC,CTCP Đầu tư Dịch vụ và Phát triển Xanh,HNX,190284000000.0
GIL,CTCP Sản xuất Kinh doanh và Xuất nhập khẩu Bình Thạnh,HOSE,2113201334400.0
GKM,CTCP GKM Holdings,HNX,147740913900.0
GLW,CTCP Cấp thoát nước Gia Lai,UPCOM,248400000000.0
GMA,CTCP G-Automobile,HNX,1293999935300.0
GMC,CTCP Garmex Sài Gòn,UPCOM,214181493500.0
GMD,CTCP Gemadept,HOSE,26991666106800.0
GMH,CTCP Minh Hưng Quảng Trị,HOSE,127215000000.0
GMX,CTCP Gạch ngói Gốm Xây dựng Mỹ Xuân,HNX,162620118000.0
GPC,CTCP Tập đoàn Green+,UPCOM,162216429000.0
GSM,CTCP Thủy điện Hương Sơn,UPCOM,685488000000.0
GSP,CTCP Vận tải Sản Phẩm Khí Quốc tế,HOSE,874654526250.0
GTA,CTCP Chế biến gỗ Thuận An,HOSE,102232000000.0
GTS,CTCP Công trình Giao thông Sài Gòn,UPCOM,310647427600.0
GVR,Tập đoàn Công nghiệp Cao su Việt Nam - CTCP,HOSE,121400000000000.0
HAC,CTCP Chứng khoán Hải Phòng,UPCOM,297599178000.0
HAD,CTCP Bia Hà Nội - Hải Dương,HNX,64000000000.0
HAF,CTCP Thực phẩm Hà Nội,UPCOM,252300000000.0
HAG,CTCP Hoàng Anh Gia Lai,HOSE,12741661360150.0
HAH,CTCP Vận tải và Xếp dỡ Hải An,HOSE,6006483004500.0
HAN,Tổng Công ty Xây dựng Hà Nội - CTCP,UPCOM,1410480000000.0
HAP,CTCP Tập đoàn Hapaco,HOSE,494802666920.0
HAR,CTCP Đầu tư Thương mại Bất động sản An Dương Thảo Điền,HOSE,322455383300.0
HAS,CTCP Hacisco,HOSE,60840000000.0
HAT,CTCP Thương mại Bia Hà Nội,HNX,130853700000.0
HAX,CTCP Dịch vụ Ô tô Hàng Xanh,HOSE,1821102592950.0
HBC,CTCP Tập đoàn Xây dựng Hòa Bình,UPCOM,2187443601000.0
HBH,CTCP Habeco - Hải Phòng,UPCOM,86400000000.0
HBS,CTCP Chứng khoán Hòa Bình,HNX,204599876000.0
HC3,CTCP Xây dựng Số 3 Hải Phòng,UPCOM,579200076000.0
HCC,CTCP Bê tông Hòa Cầm - Intimex,HNX,82133692200.0
HCD,CTCP Đầu tư Sản xuất và Thương mại HCD,HOSE,326715933440.0
HCM,CTCP Chứng khoán Thành phố Hồ Chí Minh,HOSE,21167150751600.0
HCT,CTCP Thương mại Dịch vụ Vận tải Xi măng Hải Phòng,HNX,26817920500.0
HD6,CTCP Đầu tư và Phát triển Nhà Số 6 Hà Nội,UPCOM,189000000000.0
HD8,CTCP Đầu tư Phát triển Nhà và Đô thị HUD8,UPCOM,81000000000.0
HDA,CTCP Hãng sơn Đông Á,HNX,104879874600.0
HDB,Ngân hàng TMCP Phát triển Thành phố Hồ Chí Minh,HOSE,89124048666000.0
HDC,CTCP Phát triển Nhà Bà Rịa - Vũng Tàu,HOSE,4467791898300.0
HDG,CTCP Tập đoàn Hà Đô,HOSE,9585448576500.0
HDM,CTCP Dệt may Huế,UPCOM,655138043400.0
HDW,CTCP Kinh doanh Nước sạch Hải Dương,UPCOM,427225098000.0
HEV,CTCP Sách Đại học - Dạy nghề,HNX,21900000000.0
HFT,CTCP Chứng khoán Pinetree,OTC,676500000000.0
HGM,CTCP Cơ khí và Khoáng sản Hà Giang,HNX,2908080000000.0
HGT,CTCP Du lịch Hương Giang,UPCOM,204000000000.0
HHC,CTCP Bánh kẹo Hải Hà,HNX,2145105000000.0
HHG,CTCP Hoàng Hà,UPCOM,55834166400.0
HHP,CTCP HHP Global,HOSE,714073329750.0
HHS,CTCP Đầu tư Dịch vụ Hoàng Huy,HOSE,2730455882560.0
HHV,CTCP Đầu tư Hạ tầng Giao thông Đèo Cả,HOSE,5035776901200.0
HII,CTCP An Tiến Industries,HOSE,327800421200.0
HIO,CTCP Helio Energy,UPCOM,199500000000.0
HJC,CTCP Hòa Việt,UPCOM,74547701600.0
HJS,CTCP Thủy điện Nậm Mu,HNX,734996500000.0
HKB,CTCP Nông nghiệp và Thực phẩm Hà Nội - Kinh Bắc,UPCOM,30959999400.0
HKT,CTCP Đầu tư QP Xanh,HNX,50307237800.0
HLC,CTCP Than Hà Lầm - Vinacomin,HNX,312606947700.0
HLD,CTCP Đầu tư và Phát triển Bất động sản HUDLAND,HNX,524559352600.0
HLG,CTCP Tập đoàn Hoàng Long,OTC,375915772500.0
HLY,CTCP Gốm Xây Dựng Yên Hưng,UPCOM,16498432500.0
HMC,CTCP Kim khí Thành phố Hồ Chí Minh - VNSTEEL,HOSE,348074987250.0
HMH,CTCP Hải Minh,HNX,182436587400.0
HMR,CTCP Đá Hoàng Mai,HNX,63420617200.0
HNA,CTCP Thủy điện Hủa Na,HOSE,5880805250000.0
HND,CTCP Nhiệt điện Hải Phòng,UPCOM,6450000000000.0
HNF,CTCP Thực phẩm Hữu Nghị,UPCOM,909000000000.0
HNG,CTCP Nông nghiệp Quốc tế Hoàng Anh Gia Lai,UPCOM,6762178759500.0
HNI,CTCP May Hữu Nghị,UPCOM,570693600000.0
HNM,CTCP Sữa Hà Nội,UPCOM,430680000000.0
HNR,CTCP Rượu và Nước giải khát Hà Nội,UPCOM,240000000000.0
HOM,CTCP Xi măng VICEM Hoàng Mai,HNX,266391604700.0
HPD,CTCP Thủy điện ĐăK Đoa,UPCOM,180253003000.0
HPG,CTCP Tập đoàn Hòa Phát,HOSE,170460067830000.0
HPI,CTCP Khu công nghiệp Hiệp Phước,UPCOM,1092000000000.0
HPW,CTCP Cấp nước Hải Phòng,UPCOM,1276359368000.0
HPX,CTCP Đầu tư Hải Phát,HOSE,1420467273270.0
HQC,CTCP Tư vấn Thương mại Dịch vụ Địa Ốc Hoàng Quân,HOSE,1804755727620.0
HRC,CTCP Cao su Hòa Bình,HOSE,1238471502000.0
HSG,CTCP Tập đoàn Hoa Sen,HOSE,11457123601050.0
HSL,CTCP Đầu tư Phát triển Thực phẩm Hồng Hà,HOSE,156969167410.0
HSM,Tổng Công ty cổ phần Dệt may Hà Nội,UPCOM,110700000000.0
HSP,CTCP Sơn Tổng hợp Hà Nội,UPCOM,144325032000.0
HSV,CTCP Tập đoàn HSV Việt Nam,UPCOM,61424976600.0
HT1,CTCP Xi Măng Vicem Hà Tiên,HOSE,4464601958700.0
HTC,CTCP Thương mại Hóc Môn,HNX,514799781600.0
HTE,CTCP Đầu tư Kinh doanh Điện lực Thành phố Hồ Chí Minh,UPCOM,86025027000.0
HTG,Tổng Công ty cổ phần Dệt may Hòa Thọ,HOSE,1728129984000.0
HTI,CTCP Đầu tư Phát triển Hạ tầng IDICO,HOSE,409166880000.0
HTL,CTCP Kỹ thuật và Ô tô Trường Long,HOSE,351000000000.0
HTM,Tổng Công ty Thương mại Hà Nội - CTCP,UPCOM,2419544600000.0
HTN,CTCP Hưng Thịnh Incons,HOSE,908987392200.0
HTP,CTCP In Sách Giáo khoa Hòa Phát,UPCOM,257053944000.0
HTT,CTCP Thương mại Hà Tây,UPCOM,30000000000.0
HTV,CTCP Logistics Vicem,HOSE,124488000000.0
HU1,CTCP Đầu tư và Xây dựng HUD1,HOSE,55000000000.0
HU4,CTCP Đầu tư và Xây dựng HUD4,UPCOM,205500000000.0
HUB,CTCP Xây lắp Thừa Thiên Huế,HOSE,478631553400.0
HUG,Tổng Công ty May Hưng Yên - CTCP,UPCOM,667289503800.0
HUT,CTCP Tasco,HNX,14101689047000.0
HVA,CTCP Đầu tư HVA,UPCOM,85995000000.0
